{
  "$schema": "./connector-pack.schema.json",
  "id": "lulo",
  "name": "Lulo",
  "status": "first_class",
  "aliases": ["lulo", "lulo finance", "lulo protected", "lulo boost"],
  "supportedClusters": ["mainnet-beta"],
  "requiredConfig": [
    {
      "name": "LULO_API_KEY",
      "scope": "env",
      "required": true,
      "description": "Lulo REST API key (sent as x-api-key). Required for live reads and prepared actions. Must never be persisted in receipts, prepared-action params, or browser state."
    },
    {
      "name": "LULO_API_BASE_URL",
      "scope": "env",
      "required": false,
      "description": "Override the Lulo REST API base URL. Defaults to https://api.lulo.fi."
    }
  ],
  "readCapabilities": [
    {
      "toolName": "solana_lulo_rates",
      "source": "first-class-adapter",
      "implemented": true,
      "requiresClientKey": true,
      "returns": "Protected/Boost/Regular APY by mint, with TVL and liquidity facts when the Lulo API exposes them.",
      "facts": ["mintAddress", "depositType", "apy", "tvlUsd", "liquidityAvailable"]
    },
    {
      "toolName": "solana_lulo_pool_meta",
      "source": "first-class-adapter",
      "implemented": true,
      "requiresClientKey": true,
      "returns": "Pool program ids, supported deposit types, decimals when reported, and regular-withdrawal cooldown seconds.",
      "facts": ["mintAddress", "supportedDepositTypes", "programIds", "decimals", "cooldownSeconds"]
    },
    {
      "toolName": "solana_lulo_wallet_balances",
      "source": "first-class-adapter",
      "implemented": true,
      "requiresClientKey": true,
      "returns": "Wallet deposit positions, earned interest, withdrawable balance, and pending regular withdrawals. Returns balances_unavailable when the Lulo API does not expose this for the wallet.",
      "facts": ["walletAddress", "mintAddress", "depositType", "amountUi", "earnedInterestUi", "pendingWithdrawals"]
    }
  ],
  "writeCapabilities": [
    {
      "actionKind": "lulo_deposit",
      "executionMode": "first_class_adapter",
      "implemented": true,
      "prepares": "An inbox-bound PreparedAction that captures mint, amount (human and raw), deposit type, snapshotted APY, and program ids. No transaction is signed at prepare time.",
      "executesVia": "solana_execute_prepared_action",
      "userApproves": "A Lulo deposit transaction generated freshly by the Lulo API at execution time, fee-payed by the connected wallet."
    },
    {
      "actionKind": "lulo_withdraw",
      "executionMode": "first_class_adapter",
      "implemented": true,
      "prepares": "An inbox-bound PreparedAction that captures mint, withdraw type, amount or percentage, and cooldown warnings for regular withdrawals.",
      "executesVia": "solana_execute_prepared_action",
      "userApproves": "A Lulo withdraw transaction generated freshly by the Lulo API at execution time. Regular withdrawals return a withdrawalId surfaced in the receipt."
    },
    {
      "actionKind": "lulo_complete_withdraw",
      "executionMode": "first_class_adapter",
      "implemented": true,
      "prepares": "An inbox-bound PreparedAction that finalizes a regular withdrawal after the cooldown period elapses, scoped to a specific withdrawalId.",
      "executesVia": "solana_execute_prepared_action",
      "userApproves": "A Lulo complete-withdraw transaction generated by the Lulo API for the given withdrawalId."
    }
  ],
  "requiredUserInputs": [
    {
      "name": "amount",
      "kind": "number",
      "required": true,
      "appliesTo": ["lulo_deposit"],
      "prompt": "How much do you want to deposit into Lulo?"
    },
    {
      "name": "mintAddress",
      "kind": "text",
      "required": true,
      "appliesTo": ["lulo_deposit", "lulo_withdraw", "lulo_complete_withdraw"],
      "prompt": "Which token mint should Lulo use?"
    },
    {
      "name": "depositType",
      "kind": "select",
      "required": false,
      "appliesTo": ["lulo_deposit"],
      "options": ["protected", "boost", "regular"],
      "prompt": "Which Lulo product: Protected, Boost, or Regular?"
    }
  ],
  "requiredConnectorFacts": [
    "Rates snapshot for the chosen mint and deposit type",
    "Pool metadata (supported deposit types, cooldown seconds, program ids)",
    "Wallet balance/position before withdraw or complete-withdraw",
    "Mint decimals before deposit or withdraw with explicit amount",
    "withdrawalId from the initiating regular withdraw before complete-withdraw"
  ],
  "unsupportedRequests": [
    "Promise guaranteed yield, principal safety, or risk-free returns.",
    "Deposit or withdraw on devnet/testnet.",
    "Move funds without wallet approval or with autonomous signing.",
    "Withdraw without a mint address or position context.",
    "Complete a regular withdrawal without a withdrawalId.",
    "Use Lulo when LULO_API_KEY is not configured in the host environment."
  ],
  "actionPreparationNotes": "Resolve mint decimals via the Lulo API hint or on-chain SPL Token mint info. Snapshot rates and pool metadata at prepare time; do not store the prepared transaction in params. Execution refreshes the transaction via the Lulo API. Regular withdrawals require a follow-up complete-withdraw step.",
  "riskNotes": "Surface product warnings (Protected coverage, Boost variability, Regular cooldown) before approval. Do not describe yield as guaranteed. Surface cooldown seconds and pending withdrawals before regular complete-withdraw.",
  "approvalBoundary": {
    "readGated": true,
    "writeGated": true,
    "blinkBacked": false,
    "summary": "safety.prepare_only"
  },
  "walletApprovalBoundary": "Lulo writes are prepare-only. The Lulo API generates the transaction; the wallet signs and broadcasts. The agent never signs.",
  "examples": {
    "requests": [
      {
        "user": "show Lulo Protected and Boost rates for USDC",
        "classification": "read_only_answer",
        "readTool": "solana_lulo_rates",
        "agentResponse": "Returned current Lulo Protected and Boost APY for USDC from the live API."
      },
      {
        "user": "show me Lulo pool metadata",
        "classification": "read_only_answer",
        "readTool": "solana_lulo_pool_meta",
        "agentResponse": "Returned Lulo pool program ids, supported deposit types, and cooldown seconds."
      },
      {
        "user": "show my Lulo balances",
        "classification": "read_only_answer",
        "readTool": "solana_lulo_wallet_balances",
        "agentResponse": "Returned Lulo positions for the connected wallet, including pending withdrawals."
      },
      {
        "user": "deposit 10 USDC into Lulo Protected",
        "classification": "prepare_approval_action",
        "writeAction": "lulo_deposit",
        "agentResponse": "Prepared a Lulo Protected deposit of 10 USDC. This prepares a wallet approval request; it does not sign."
      },
      {
        "user": "deposit into Lulo",
        "classification": "needs_input",
        "needsInputQuestions": [
          "How much do you want to deposit into Lulo?",
          "Which token mint should Lulo use?",
          "Which Lulo product: Protected, Boost, or Regular?"
        ],
        "agentResponse": "Amount, mint, and deposit type are required before preparing a Lulo deposit."
      },
      {
        "user": "withdraw 50 percent from Lulo Protected USDC",
        "classification": "prepare_approval_action",
        "writeAction": "lulo_withdraw",
        "agentResponse": "Prepared a Lulo Protected withdrawal of 50 percent of the USDC position. This prepares a wallet approval request; it does not sign."
      },
      {
        "user": "complete my Lulo regular withdrawal id 12345",
        "classification": "prepare_approval_action",
        "writeAction": "lulo_complete_withdraw",
        "agentResponse": "Prepared the complete step for Lulo regular withdrawal #12345 once the cooldown elapses."
      },
      {
        "user": "guarantee Lulo Protected yield",
        "classification": "unsupported",
        "denialReason": "safety.no_safety_guarantee",
        "agentResponse": "Lulo Protected coverage is not a guarantee. The agent will not claim risk-free yield."
      },
      {
        "user": "deposit into Lulo on devnet",
        "classification": "unsupported",
        "denialReason": "safety.action_not_exposed",
        "agentResponse": "Lulo connector actions are mainnet-beta only."
      },
      {
        "user": "auto-deposit all my USDC into Lulo without my wallet",
        "classification": "unsupported",
        "denialReason": "safety.no_autonomous_funds",
        "agentResponse": "Lulo writes require wallet approval. The agent will not move funds without the wallet signing."
      },
      {
        "user": "complete my Lulo withdrawal",
        "classification": "needs_input",
        "needsInputQuestions": [
          "Which token mint?",
          "Which Lulo withdrawalId should I complete?"
        ],
        "agentResponse": "Mint and withdrawalId are required before completing a Lulo regular withdrawal."
      }
    ]
  },
  "mirrorsCanonical": {
    "file": "apps/browser-demo/src/connectedDapps.ts",
    "entry": "lulo",
    "note": "Mirrors the Lulo browser catalog entry. Update both when capabilities, aliases, readTools, or actionKinds change."
  }
}
