{
  "$schema": "./connector-pack.schema.json",
  "id": "meteora",
  "name": "Meteora",
  "status": "blink_backed",
  "aliases": ["meteora", "dlmm", "meteora dlmm"],
  "supportedClusters": ["mainnet-beta"],
  "requiredConfig": [
    {
      "name": "Dialect client key",
      "scope": "dialect_client_key",
      "required": true,
      "description": "Needed for generic position and market reads until a first-class Meteora adapter exists."
    },
    {
      "name": "Meteora DLMM position endpoint",
      "scope": "env",
      "required": true,
      "description": "Planned endpoint for wallet-specific DLMM position status. Not implemented in MCP runtime yet."
    }
  ],
  "readCapabilities": [
    {
      "toolName": "meteora_dlmm_position",
      "source": "meteora-api",
      "implemented": false,
      "requiresClientKey": true,
      "returns": "Planned DLMM position facts: pool, bins/range, token balances, fees, rewards, and position health.",
      "facts": ["poolAddress", "positionAddress", "binRange", "tokenBalances", "unclaimedFees", "unclaimedRewards"]
    },
    {
      "toolName": "dialect_positions",
      "source": "dialect-markets",
      "implemented": false,
      "requiresClientKey": true,
      "returns": "Planned generic wallet positions when Dialect connector reads are configured.",
      "facts": ["positionAddress", "poolAddress", "liquidity", "fees"]
    },
    {
      "toolName": "dialect_markets",
      "source": "dialect-markets",
      "implemented": false,
      "requiresClientKey": true,
      "returns": "Planned market and action URL facts for Meteora pools.",
      "facts": ["poolAddress", "liquidity", "volume24h", "feeApr", "actionUrl"]
    }
  ],
  "writeCapabilities": [
    {
      "actionKind": "blink_action",
      "executionMode": "blink",
      "implemented": false,
      "prepares": "A planned approval-bound Blink action for add liquidity, withdraw liquidity, claim fees, or close position. MCP runtime does not expose the generic Blink helper yet.",
      "executesVia": "solana_execute_prepared_action",
      "userApproves": "A Meteora Solana Action transaction after the user reviews pool, position, token amounts, and fee facts."
    }
  ],
  "requiredUserInputs": [
    {
      "name": "poolAddress",
      "kind": "text",
      "required": true,
      "appliesTo": ["blink_action"],
      "prompt": "Which Meteora pool or DLMM position should I use?"
    },
    {
      "name": "amount",
      "kind": "number",
      "required": true,
      "appliesTo": ["blink_action"],
      "prompt": "How much liquidity or token amount should I prepare?"
    },
    {
      "name": "blinkUrl",
      "kind": "text",
      "required": true,
      "appliesTo": ["blink_action"],
      "prompt": "Paste the Meteora Blink or Solana Action URL for this action."
    }
  ],
  "requiredConnectorFacts": [
    "Pool address and token pair",
    "Position address for wallet-specific actions",
    "Current bin range or liquidity range",
    "Unclaimed fees and rewards",
    "Blink action URL and action metadata",
    "Wallet token balances for both pool tokens"
  ],
  "unsupportedRequests": [
    "Prepare Meteora actions without a pool, position, or Blink URL.",
    "Claim fees when no position address is supplied.",
    "Close a position without first reading position facts.",
    "Guarantee profitability or impermanent-loss safety.",
    "Operate outside mainnet-beta.",
    "Move funds without a wallet signature."
  ],
  "actionPreparationNotes": "Until a first-class adapter lands, treat Meteora actions as Blink-backed. The agent may review supplied action metadata, but must not invent pool, range, or fee facts. Ask for pool/position and Blink URL when missing.",
  "riskNotes": "Meteora DLMM positions are sensitive to range selection, bin movement, fees, rewards, and impermanent loss. Display pool and position facts before approval.",
  "approvalBoundary": {
    "readGated": true,
    "writeGated": true,
    "blinkBacked": true,
    "summary": "safety.prepare_only"
  },
  "walletApprovalBoundary": "The connector may read pool and position facts when configured. Writes are Blink-backed and only prepare a wallet approval request; the wallet signs separately.",
  "examples": {
    "requests": [
      {
        "user": "check my Meteora DLMM position",
        "classification": "needs_input",
        "needsInputQuestions": ["Which position address or pool should I check?"],
        "agentResponse": "The agent is missing facts needed to decide. Provide the position or pool so it can read connector facts."
      },
      {
        "user": "show my Meteora fees",
        "classification": "needs_input",
        "needsInputQuestions": ["Which Meteora position should I read?"],
        "agentResponse": "The agent is missing facts needed to decide. Fee reads require a wallet position."
      },
      {
        "user": "add liquidity to this Meteora pool",
        "classification": "needs_input",
        "needsInputQuestions": ["Which pool address?", "What token amounts?", "Paste the Meteora Blink URL."],
        "agentResponse": "The agent is missing facts needed to decide. Pool, amounts, and action URL are required."
      },
      {
        "user": "add 1 SOL and 100 USDC to Meteora with this Blink URL",
        "classification": "prepare_approval_action",
        "writeAction": "blink_action",
        "agentResponse": "Prepared a Meteora Blink review if the action metadata matches the requested pool and amounts. This prepares a wallet approval request; it does not sign."
      },
      {
        "user": "claim fees from my Meteora position using this action URL",
        "classification": "prepare_approval_action",
        "writeAction": "blink_action",
        "agentResponse": "Prepared a claim-fees Blink review after checking the position id and action metadata."
      },
      {
        "user": "close my Meteora position without checking it",
        "classification": "unsupported",
        "denialReason": "safety.missing_facts",
        "agentResponse": "The agent denied this because position facts are required before a close action can be reviewed."
      },
      {
        "user": "guarantee this Meteora range is safe",
        "classification": "unsupported",
        "denialReason": "safety.no_safety_guarantee",
        "agentResponse": "The agent denied this because it cannot guarantee safety or profitability."
      },
      {
        "user": "withdraw Meteora liquidity on devnet",
        "classification": "unsupported",
        "denialReason": "safety.action_not_exposed",
        "agentResponse": "The agent denied this because Meteora connector actions are only cataloged for mainnet-beta."
      },
      {
        "user": "move my Meteora LP without opening my wallet",
        "classification": "unsupported",
        "denialReason": "safety.no_autonomous_funds",
        "agentResponse": "The agent denied this because the connector cannot move funds without the user's wallet."
      },
      {
        "user": "what is the APY on this Meteora pool?",
        "classification": "needs_input",
        "needsInputQuestions": ["Which pool address should I read?"],
        "agentResponse": "The agent is missing facts needed to decide. A pool address is required before reading market facts."
      }
    ]
  },
  "mirrorsCanonical": {
    "file": "apps/browser-demo/src/connectedDapps.ts",
    "entry": "meteora",
    "note": "Mirrors the Meteora connector entry and marks runtime implementation gaps explicitly."
  }
}
